{
  "$schema": "https://json-schema.org/draft/2020-12/schema",
  "title": "WebsiteSpecialistHarnessRecord",
  "description": "Canonical website specialist harness record that proves route honesty and execution state with persona and continuity markers preserved.",
  "type": "object",
  "additionalProperties": false,
  "properties": {
    "harness_id": { "type": "string" },
    "request": { "$ref": "./website-specialist-request.schema.json" },
    "execution": { "$ref": "./website-specialist-execution.schema.json" },
    "support_safe_outcome_summary": { "type": "string" },
    "activation_handoff_status": {
      "type": "string",
      "enum": ["activation_ready", "blocked", "handoff_complete"]
    }
  },
  "required": [
    "harness_id",
    "request",
    "execution",
    "support_safe_outcome_summary",
    "activation_handoff_status"
  ]
}
